{
  "artifact": {
    "commit": "4c2d8dbf0ddfb7f38ba1f228369ae2d929319758",
    "distribution_root": "<scratch-root>/venv/lib/python3.12/site-packages",
    "executable": "<scratch-root>/venv/bin/talaria",
    "executable_sha256": "a99c86d648f59d2b7f0f9f2bc58da1f91e2ed45eb4dd8dc205bd21f161940066",
    "install_receipt_path": "docs/acceptance/v0.5.0/evidence/t2/install-receipt.json",
    "install_receipt_sha256": "9f725d66a6488b29bf87a0077b5fab6c6c60dff37c2bd162f141701f33b8542a",
    "installed_files_sha256": "a0a0e1900055b8c422a31b1a22ab196f165910ea0c3ba32c3daaf6ab856a1368",
    "version": "0.5.0",
    "wheel_filename": "talaria-0.5.0-py3-none-any.whl",
    "wheel_sha256": "d5a41c67384e78d9b1048cb7c6524a668c20f8059031e0f5e0a93f0b289f7d88"
  },
  "checklist_item": 29,
  "evidence": {
    "capture_path": "docs/acceptance/v0.5.0/evidence/t2/raw/item-29-c3.ansi",
    "capture_sha256": "8fa574b20e6439ea99d4798e34307fc4fef133c0c65f765cf5f247555faf3c8d",
    "pty_result_path": "docs/acceptance/v0.5.0/evidence/t2/pty-results/item-29-c3-pty.json",
    "pty_result_sha256": "7a110deaf73ff9a8880b07c34eaec6abb538970320fd64146a7cf1d6dd6b2422",
    "redaction_review": "passed",
    "screenshot_path": "docs/acceptance/v0.5.0/evidence/t2/screenshots/item-29-c3.png",
    "screenshot_sha256": "da6d6203cae9c127ad5ffdecae18cdf6f2afa3e8948a24d671d3049ba372af44"
  },
  "harness_commit": "4c2d8dbf0ddfb7f38ba1f228369ae2d929319758",
  "observations": [
    "The required 132-by-36 wide frame has the 36-column inspector dock, stable main hierarchy, and fixed one-row help and status bars."
  ],
  "owner": "talaria-t2",
  "recorded_at": "2026-09-01T15:26:22+00:00",
  "release": "0.5.0",
  "schema_version": "talaria-v0.5.0-receipt-v1",
  "session": {
    "mode": "replay",
    "model_route": {
      "fallback_availability": "not-applicable",
      "fallback_reason": null,
      "observed": null,
      "requested": null,
      "status": "not-applicable"
    },
    "profile": "acceptance-replay"
  },
  "terminal": {
    "columns": 132,
    "program": "Terminal.app 2.14",
    "rows": 36,
    "term": "xterm-256color"
  },
  "tester": "talaria-t2",
  "title": "Wide screenshot",
  "verdict": "pass"
}
