{
  "artifact": {
    "commit": "4c2d8dbf0ddfb7f38ba1f228369ae2d929319758",
    "distribution_root": "<scratch-root>/venv/lib/python3.12/site-packages",
    "executable": "<scratch-root>/venv/bin/talaria",
    "executable_sha256": "a99c86d648f59d2b7f0f9f2bc58da1f91e2ed45eb4dd8dc205bd21f161940066",
    "install_receipt_path": "docs/acceptance/v0.5.0/evidence/t2/install-receipt.json",
    "install_receipt_sha256": "9f725d66a6488b29bf87a0077b5fab6c6c60dff37c2bd162f141701f33b8542a",
    "installed_files_sha256": "a0a0e1900055b8c422a31b1a22ab196f165910ea0c3ba32c3daaf6ab856a1368",
    "version": "0.5.0",
    "wheel_filename": "talaria-0.5.0-py3-none-any.whl",
    "wheel_sha256": "d5a41c67384e78d9b1048cb7c6524a668c20f8059031e0f5e0a93f0b289f7d88"
  },
  "checklist_item": 35,
  "evidence": {
    "capture_path": "docs/acceptance/v0.5.0/evidence/t2/raw/item-35-running-c3.ansi",
    "capture_sha256": "7405781ee3e90caf6f76675c5009901f85770139850108764cb7af36acad5684",
    "pty_result_path": "docs/acceptance/v0.5.0/evidence/t2/pty-results/item-35-running-c3-pty.json",
    "pty_result_sha256": "1b1a6ebe149f5637248b37520a8144317e1444f32badb873f36944fc392d041e",
    "redaction_review": "passed",
    "screenshot_path": "docs/acceptance/v0.5.0/evidence/t2/screenshots/item-35-restart-c3.png",
    "screenshot_sha256": "e40cdeefc7c24b1cfec5e9fb9003ae8e421d1d2c28d405cee713bfcdc29174aa"
  },
  "harness_commit": "4c2d8dbf0ddfb7f38ba1f228369ae2d929319758",
  "observations": [
    "The running process kept connection,version after the scratch file changed; only the restarted process applied cwd,connection,version."
  ],
  "owner": "shared",
  "recorded_at": "2026-09-01T15:26:22+00:00",
  "release": "0.5.0",
  "schema_version": "talaria-v0.5.0-receipt-v1",
  "session": {
    "mode": "replay",
    "model_route": {
      "fallback_availability": "not-applicable",
      "fallback_reason": null,
      "observed": null,
      "requested": null,
      "status": "not-applicable"
    },
    "profile": "acceptance-replay"
  },
  "terminal": {
    "columns": 144,
    "program": "Terminal.app 2.14",
    "rows": 36,
    "term": "xterm-256color"
  },
  "tester": "talaria-t2",
  "title": "Restart-only configuration",
  "verdict": "pass"
}
