{
  "artifact": {
    "commit": "4c2d8dbf0ddfb7f38ba1f228369ae2d929319758",
    "distribution_root": "<scratch-root>/venv/lib/python3.12/site-packages",
    "executable": "<scratch-root>/venv/bin/talaria",
    "executable_sha256": "21cc6610496455d946eb01fb269dc381af79f0998860d76aae69c58e986c1167",
    "install_receipt_path": "docs/acceptance/v0.5.0/evidence/t1/install-receipt.json",
    "install_receipt_sha256": "ee8e0ee1ce883d6719efa5263bc552c3d2a44832e8602ad7c746038becc90246",
    "installed_files_sha256": "6138a46811ca17a27fdff6ee18755f502de0fdf1a96488b25f89558f5797e6af",
    "version": "0.5.0",
    "wheel_filename": "talaria-0.5.0-py3-none-any.whl",
    "wheel_sha256": "d5a41c67384e78d9b1048cb7c6524a668c20f8059031e0f5e0a93f0b289f7d88"
  },
  "checklist_item": 26,
  "evidence": {
    "capture_path": "docs/acceptance/v0.5.0/evidence/t1/raw/item-26-reduced-c3.ansi",
    "capture_sha256": "1f13226deaf3aed7ff7f8145af238d1f1c71f5ba728902a2068d17f60667ae9d",
    "pty_result_path": "docs/acceptance/v0.5.0/evidence/t1/pty-results/item-26-reduced-c3-pty.json",
    "pty_result_sha256": "5c2fef9cbe077d12d0e11f5a72539dc479b0a6084a9399039d208064e6adcdab",
    "redaction_review": "passed",
    "screenshot_path": "docs/acceptance/v0.5.0/evidence/t1/screenshots/item-26-reduced-c3.png",
    "screenshot_sha256": "38b0c153e5385360e0dbfcacbc4500489611f8421e0db37eb8f8b9b46aa631d1"
  },
  "harness_commit": "4c2d8dbf0ddfb7f38ba1f228369ae2d929319758",
  "observations": [
    "A standard-motion drive showed working ellipsis while ui.reduced_motion=true restarted into static [..] working; completion and state updates remained live in both drives."
  ],
  "owner": "talaria-t1",
  "recorded_at": "2026-09-01T15:32:09+00:00",
  "release": "0.5.0",
  "schema_version": "talaria-v0.5.0-receipt-v1",
  "session": {
    "mode": "replay",
    "model_route": {
      "fallback_availability": "not-applicable",
      "fallback_reason": null,
      "observed": null,
      "requested": null,
      "status": "not-applicable"
    },
    "profile": "isolated reduced-motion restart pair"
  },
  "terminal": {
    "columns": 132,
    "program": "Python pty.fork on macOS; COLUMNS/LINES unpinned",
    "rows": 36,
    "term": "xterm-256color"
  },
  "tester": "talaria-t1",
  "title": "Reduced motion",
  "verdict": "pass"
}
